<employee xmlns:xsi="http://www.w3.org/2001/XMLSchema-instance" xsi:noNamespaceSchemaLocation="employee.xsd">
    <id>1</id>
    <name>John</name>
    <surname>Doe</surname>
    <phoneNumber>123-456-7890</phoneNumber>
    <position>Manager</position>
    <contracts>
        <contract>
            <id>1</id>
            <startDate>2022-01-01</startDate>
            <endDate>2023-01-01</endDate>
            <type>Full-time</type>
            <salary>50000.0</salary>
            <active>true</active>
        </contract>
    </contracts>
    <monthlyPayments>
        <monthlyPayment>
            <id>1</id>
            <amount>2000.0</amount>
            <paymentDate>2022-01-15</paymentDate>
            <bonusPayments>
                <bonusPayment>
                    <id>1</id>
                    <amount>500.0</amount>
                    <description>Year-end Bonus</description>
                </bonusPayment>
                <bonusPayment>
                    <id>2</id>
                    <amount>1000.0</amount>
                    <description>Bonus</description>
                </bonusPayment>
            </bonusPayments>
        </monthlyPayment>
        <monthlyPayment>
            <id>2</id>
            <amount>3000.0</amount>
            <paymentDate>2022-01-16</paymentDate>
            <bonusPayments>
                <bonusPayment>
                    <id>3</id>
                    <amount>230.0</amount>
                    <description>Year-end Bonus</description>
                </bonusPayment>
                <bonusPayment>
                    <id>4</id>
                    <amount>12000.0</amount>
                    <description>Bonus</description>
                </bonusPayment>
            </bonusPayments>
        </monthlyPayment>
    </monthlyPayments>
    <account>
        <id>1</id>
        <login>johndoe</login>
        <password>hashed_password</password>
    </account>
</employee>
